{
  "$schema": "https://json-schema.org/draft/2020-12/schema",
  "$id": "https://microtodosuite.example/specs/005-namespace-isolation/contracts/namespace-isolation-evidence.schema.json",
  "title": "MicroTodoSuite Shared-Cluster Isolation and Release Evidence",
  "type": "object",
  "additionalProperties": false,
  "required": [
    "schemaVersion",
    "feature",
    "constitutionVersion",
    "phase",
    "expectedRevision",
    "cleanupRevision",
    "cluster",
    "applicationInventory",
    "environments",
    "releases",
    "secrets",
    "progressiveSync",
    "productionCanaries",
    "crossEnvironmentTests",
    "sameEnvironmentTests",
    "dnsTests",
    "redisIsolation",
    "resourceViolation",
    "rbac",
    "devSnapshot",
    "devContinuity",
    "commandAudit",
    "blockedReasons",
    "result"
  ],
  "properties": {
    "schemaVersion": { "const": "2.0.0" },
    "feature": { "const": "005-namespace-isolation" },
    "constitutionVersion": { "const": "3.0.0" },
    "phase": {
      "enum": ["baseline", "prerequisites", "activated", "canary", "fixtures", "final"]
    },
    "expectedRevision": { "$ref": "#/$defs/gitSha" },
    "cleanupRevision": {
      "oneOf": [
        { "$ref": "#/$defs/gitSha" },
        { "type": "null" }
      ]
    },
    "cluster": { "$ref": "#/$defs/cluster" },
    "applicationInventory": { "$ref": "#/$defs/applicationInventory" },
    "environments": {
      "type": "array",
      "minItems": 3,
      "maxItems": 3,
      "items": { "$ref": "#/$defs/environment" }
    },
    "releases": {
      "type": "array",
      "maxItems": 5,
      "items": { "$ref": "#/$defs/release" }
    },
    "secrets": {
      "type": "array",
      "maxItems": 3,
      "items": { "$ref": "#/$defs/secretPath" }
    },
    "progressiveSync": { "$ref": "#/$defs/progressiveSync" },
    "productionCanaries": { "$ref": "#/$defs/productionCanaries" },
    "crossEnvironmentTests": {
      "type": "array",
      "maxItems": 6,
      "items": { "$ref": "#/$defs/connection" }
    },
    "sameEnvironmentTests": {
      "type": "array",
      "maxItems": 3,
      "items": { "$ref": "#/$defs/connection" }
    },
    "dnsTests": {
      "type": "array",
      "maxItems": 3,
      "items": { "$ref": "#/$defs/environmentResult" }
    },
    "redisIsolation": { "$ref": "#/$defs/redisIsolation" },
    "resourceViolation": {
      "oneOf": [
        { "$ref": "#/$defs/resourceViolation" },
        { "type": "null" }
      ]
    },
    "rbac": { "$ref": "#/$defs/rbac" },
    "devSnapshot": { "$ref": "#/$defs/devSnapshot" },
    "devContinuity": {
      "type": "array",
      "items": { "$ref": "#/$defs/continuity" }
    },
    "commandAudit": {
      "type": "object",
      "additionalProperties": false,
      "required": ["mutatingCommands", "secretValuesPrinted", "result"],
      "properties": {
        "mutatingCommands": { "const": 0 },
        "secretValuesPrinted": { "const": 0 },
        "result": { "const": "PASS" }
      }
    },
    "blockedReasons": {
      "type": "array",
      "items": { "type": "string", "minLength": 1 },
      "uniqueItems": true
    },
    "result": { "enum": ["PASS", "BLOCKED", "FAIL"] }
  },
  "allOf": [
    {
      "if": {
        "properties": {
          "phase": { "enum": ["activated", "canary", "fixtures", "final"] }
        }
      },
      "then": {
        "properties": {
          "releases": { "minItems": 5, "maxItems": 5 },
          "secrets": { "minItems": 3, "maxItems": 3 },
          "applicationInventory": {
            "properties": {
              "businessApplications": { "minItems": 15, "maxItems": 15 }
            }
          }
        }
      }
    },
    {
      "if": {
        "properties": {
          "phase": { "enum": ["canary", "fixtures", "final"] }
        }
      },
      "then": {
        "properties": {
          "productionCanaries": {
            "properties": {
              "successful": { "minItems": 5, "maxItems": 5 },
              "negativeGate": { "$ref": "#/$defs/negativeCanary" }
            }
          }
        }
      }
    },
    {
      "if": {
        "properties": {
          "phase": { "enum": ["fixtures", "final"] }
        }
      },
      "then": {
        "properties": {
          "crossEnvironmentTests": { "minItems": 6, "maxItems": 6 },
          "sameEnvironmentTests": { "minItems": 3, "maxItems": 3 },
          "dnsTests": { "minItems": 3, "maxItems": 3 },
          "resourceViolation": { "$ref": "#/$defs/resourceViolation" }
        }
      }
    },
    {
      "if": { "properties": { "result": { "const": "PASS" } } },
      "then": { "properties": { "blockedReasons": { "maxItems": 0 } } }
    },
    {
      "if": { "properties": { "result": { "const": "BLOCKED" } } },
      "then": { "properties": { "blockedReasons": { "minItems": 1 } } }
    }
  ],
  "$defs": {
    "gitSha": {
      "type": "string",
      "pattern": "^[0-9a-f]{40}$"
    },
    "digest": {
      "type": "string",
      "pattern": "^sha256:[0-9a-f]{64}$"
    },
    "environmentName": {
      "enum": ["dev", "staging", "prod"]
    },
    "namespaceName": {
      "enum": ["microtodo-dev", "microtodo-staging", "microtodo-prod"]
    },
    "serviceName": {
      "enum": ["auth-api", "todos-api", "users-api", "frontend", "log-message-processor"]
    },
    "result": {
      "enum": ["PASS", "BLOCKED", "FAIL", "NOT_RUN"]
    },
    "cluster": {
      "type": "object",
      "additionalProperties": false,
      "required": [
        "name",
        "provider",
        "kubernetesVersion",
        "cniVersion",
        "networkPolicyEnabled",
        "eligibleNodes",
        "readyPolicyAgents",
        "allocatableMilliCpu",
        "allocatableMemoryKi",
        "platformRequestedMilliCpu",
        "result"
      ],
      "properties": {
        "name": { "const": "microtodosuite-dev" },
        "provider": { "const": "amazon-vpc-cni" },
        "kubernetesVersion": { "type": "string", "minLength": 1 },
        "cniVersion": { "type": "string", "minLength": 1 },
        "networkPolicyEnabled": { "const": true },
        "eligibleNodes": { "type": "integer", "minimum": 1 },
        "readyPolicyAgents": { "type": "integer", "minimum": 1 },
        "allocatableMilliCpu": { "type": "integer", "minimum": 1 },
        "allocatableMemoryKi": { "type": "integer", "minimum": 1 },
        "platformRequestedMilliCpu": { "type": "integer", "minimum": 0 },
        "result": { "$ref": "#/$defs/result" }
      }
    },
    "applicationInventory": {
      "type": "object",
      "additionalProperties": false,
      "required": [
        "environmentApplications",
        "businessApplications",
        "infrastructureApplications",
        "result"
      ],
      "properties": {
        "environmentApplications": {
          "type": "array",
          "minItems": 3,
          "maxItems": 3,
          "uniqueItems": true,
          "items": { "enum": ["env-dev", "env-staging", "env-prod"] }
        },
        "businessApplications": {
          "type": "array",
          "maxItems": 15,
          "uniqueItems": true,
          "items": { "type": "string", "pattern": "^[a-z-]+-(dev|staging|prod)$" }
        },
        "infrastructureApplications": {
          "type": "array",
          "minItems": 5,
          "maxItems": 5,
          "uniqueItems": true,
          "items": {
            "enum": [
              "infra-keda",
              "infra-cert-manager",
              "infra-external-secrets",
              "infra-kyverno",
              "infra-redis",
              "infra-argo-rollouts"
            ]
          }
        },
        "result": { "$ref": "#/$defs/result" }
      }
    },
    "environment": {
      "type": "object",
      "additionalProperties": false,
      "required": [
        "environment",
        "namespace",
        "application",
        "revision",
        "sync",
        "health",
        "quota",
        "redisReady",
        "externalSecretReady",
        "result"
      ],
      "properties": {
        "environment": { "$ref": "#/$defs/environmentName" },
        "namespace": { "$ref": "#/$defs/namespaceName" },
        "application": { "enum": ["env-dev", "env-staging", "env-prod"] },
        "revision": { "$ref": "#/$defs/gitSha" },
        "sync": { "enum": ["Synced", "OutOfSync"] },
        "health": { "enum": ["Healthy", "Progressing", "Degraded"] },
        "quota": { "$ref": "#/$defs/quota" },
        "redisReady": { "type": "boolean" },
        "externalSecretReady": { "type": "boolean" },
        "result": { "$ref": "#/$defs/result" }
      }
    },
    "quota": {
      "type": "object",
      "additionalProperties": false,
      "required": ["hard", "used"],
      "properties": {
        "hard": { "$ref": "#/$defs/resourceValues" },
        "used": { "$ref": "#/$defs/resourceValues" }
      }
    },
    "resourceValues": {
      "type": "object",
      "additionalProperties": false,
      "required": ["requestsCpu", "limitsCpu", "requestsMemory", "limitsMemory", "pods"],
      "properties": {
        "requestsCpu": { "type": "string", "minLength": 1 },
        "limitsCpu": { "type": "string", "minLength": 1 },
        "requestsMemory": { "type": "string", "minLength": 1 },
        "limitsMemory": { "type": "string", "minLength": 1 },
        "pods": { "type": "string", "pattern": "^[0-9]+$" }
      }
    },
    "release": {
      "type": "object",
      "additionalProperties": false,
      "required": [
        "service",
        "baselineCommit",
        "releaseCommit",
        "workflowRevision",
        "workflowRunUrl",
        "testsPassed",
        "trivyPassed",
        "sbomArtifact",
        "repository",
        "digest",
        "signatureVerified",
        "podImageIds",
        "result"
      ],
      "properties": {
        "service": { "$ref": "#/$defs/serviceName" },
        "baselineCommit": { "$ref": "#/$defs/gitSha" },
        "releaseCommit": { "$ref": "#/$defs/gitSha" },
        "workflowRevision": { "$ref": "#/$defs/gitSha" },
        "workflowRunUrl": { "type": "string", "format": "uri" },
        "testsPassed": { "const": true },
        "trivyPassed": { "const": true },
        "sbomArtifact": { "type": "string", "minLength": 1 },
        "repository": { "type": "string", "pattern": "microtodosuite/[a-z-]+$" },
        "digest": { "$ref": "#/$defs/digest" },
        "signatureVerified": { "const": true },
        "podImageIds": {
          "type": "array",
          "items": { "type": "string", "minLength": 1 }
        },
        "result": { "$ref": "#/$defs/result" }
      }
    },
    "secretPath": {
      "type": "object",
      "additionalProperties": false,
      "required": [
        "environment",
        "sourceName",
        "readerRoleArn",
        "externalSecretReady",
        "destinationNonEmpty",
        "distinctFromOtherEnvironments",
        "crossEnvironmentDenials",
        "result"
      ],
      "properties": {
        "environment": { "$ref": "#/$defs/environmentName" },
        "sourceName": { "type": "string", "minLength": 1 },
        "readerRoleArn": { "type": "string", "pattern": "^arn:aws:iam::[0-9]{12}:role/.+$" },
        "externalSecretReady": { "const": true },
        "destinationNonEmpty": { "const": true },
        "distinctFromOtherEnvironments": { "const": true },
        "crossEnvironmentDenials": { "type": "integer", "minimum": 2, "maximum": 2 },
        "result": { "$ref": "#/$defs/result" }
      }
    },
    "progressiveSync": {
      "type": "object",
      "additionalProperties": false,
      "required": ["featureFlagEnabled", "steps", "maxUpdate", "observedOrder", "result"],
      "properties": {
        "featureFlagEnabled": { "type": "boolean" },
        "steps": {
          "type": "array",
          "items": { "$ref": "#/$defs/environmentName" },
          "prefixItems": [
            { "const": "dev" },
            { "const": "staging" },
            { "const": "prod" }
          ],
          "minItems": 3,
          "maxItems": 3
        },
        "maxUpdate": { "const": 1 },
        "observedOrder": {
          "type": "array",
          "maxItems": 3,
          "items": { "$ref": "#/$defs/environmentName" }
        },
        "result": { "$ref": "#/$defs/result" }
      }
    },
    "productionCanaries": {
      "type": "object",
      "additionalProperties": false,
      "required": ["initialCreationRecordedAsBootstrap", "successful", "negativeGate", "result"],
      "properties": {
        "initialCreationRecordedAsBootstrap": { "type": "boolean" },
        "successful": {
          "type": "array",
          "maxItems": 5,
          "items": { "$ref": "#/$defs/successfulCanary" }
        },
        "negativeGate": {
          "oneOf": [
            { "$ref": "#/$defs/negativeCanary" },
            { "type": "null" }
          ]
        },
        "result": { "$ref": "#/$defs/result" }
      }
    },
    "successfulCanary": {
      "type": "object",
      "additionalProperties": false,
      "required": ["service", "digest", "analysisPhase", "rolloutPhase", "result"],
      "properties": {
        "service": { "$ref": "#/$defs/serviceName" },
        "digest": { "$ref": "#/$defs/digest" },
        "analysisPhase": { "const": "Successful" },
        "rolloutPhase": { "const": "Healthy" },
        "result": { "const": "PASS" }
      }
    },
    "negativeCanary": {
      "type": "object",
      "additionalProperties": false,
      "required": [
        "service",
        "analysisPhase",
        "rolloutPhase",
        "stableRestored",
        "reverted",
        "result"
      ],
      "properties": {
        "service": { "$ref": "#/$defs/serviceName" },
        "analysisPhase": { "const": "Failed" },
        "rolloutPhase": { "const": "Degraded" },
        "stableRestored": { "const": true },
        "reverted": { "const": true },
        "result": { "const": "PASS" }
      }
    },
    "connection": {
      "type": "object",
      "additionalProperties": false,
      "required": ["source", "destination", "protocol", "port", "expected", "observed", "result"],
      "properties": {
        "source": { "$ref": "#/$defs/environmentName" },
        "destination": { "$ref": "#/$defs/environmentName" },
        "protocol": { "const": "TCP" },
        "port": { "type": "integer", "minimum": 1, "maximum": 65535 },
        "expected": { "enum": ["allowed", "denied"] },
        "observed": { "enum": ["allowed", "denied"] },
        "result": { "$ref": "#/$defs/result" }
      }
    },
    "environmentResult": {
      "type": "object",
      "additionalProperties": false,
      "required": ["environment", "result"],
      "properties": {
        "environment": { "$ref": "#/$defs/environmentName" },
        "result": { "$ref": "#/$defs/result" }
      }
    },
    "redisIsolation": {
      "type": "object",
      "additionalProperties": false,
      "required": [
        "instancesReady",
        "pongPasses",
        "crossEnvironmentDenials",
        "pubSubIsolated",
        "sharedApplicationPresent",
        "sharedNamespacePresent",
        "result"
      ],
      "properties": {
        "instancesReady": { "type": "integer", "minimum": 0, "maximum": 3 },
        "pongPasses": { "type": "integer", "minimum": 0, "maximum": 3 },
        "crossEnvironmentDenials": { "type": "integer", "minimum": 0, "maximum": 6 },
        "pubSubIsolated": { "type": "integer", "minimum": 0, "maximum": 3 },
        "sharedApplicationPresent": { "type": "boolean" },
        "sharedNamespacePresent": { "type": "boolean" },
        "result": { "$ref": "#/$defs/result" }
      }
    },
    "resourceViolation": {
      "type": "object",
      "additionalProperties": false,
      "required": [
        "environment",
        "bound",
        "eventReason",
        "comparisonEnvironment",
        "comparisonReadyReplicaLoss",
        "comparisonRestartDelta",
        "result"
      ],
      "properties": {
        "environment": { "$ref": "#/$defs/environmentName" },
        "bound": {
          "enum": [
            "requests.cpu",
            "limits.cpu",
            "requests.memory",
            "limits.memory",
            "pods",
            "containerMaxCpu",
            "containerMaxMemory"
          ]
        },
        "eventReason": { "type": "string", "minLength": 1 },
        "comparisonEnvironment": { "$ref": "#/$defs/environmentName" },
        "comparisonReadyReplicaLoss": { "const": 0 },
        "comparisonRestartDelta": { "const": 0 },
        "result": { "const": "PASS" }
      }
    },
    "rbac": {
      "type": "object",
      "additionalProperties": false,
      "required": ["groupChecks", "principalMappingsVerified", "result"],
      "properties": {
        "groupChecks": {
          "type": "array",
          "items": {
            "type": "object",
            "additionalProperties": false,
            "required": ["subject", "namespace", "verb", "resource", "expected", "observed", "result"],
            "properties": {
              "subject": { "type": "string", "minLength": 1 },
              "namespace": { "$ref": "#/$defs/namespaceName" },
              "verb": { "type": "string", "minLength": 1 },
              "resource": { "type": "string", "minLength": 1 },
              "expected": { "enum": ["allow", "deny"] },
              "observed": { "enum": ["allow", "deny"] },
              "result": { "$ref": "#/$defs/result" }
            }
          }
        },
        "principalMappingsVerified": { "type": "boolean" },
        "result": { "$ref": "#/$defs/result" }
      }
    },
    "devServiceSnapshot": {
      "type": "object",
      "additionalProperties": false,
      "required": ["name", "desiredReplicas", "readyReplicas", "readyPods", "restarts", "imageIds"],
      "properties": {
        "name": { "$ref": "#/$defs/serviceName" },
        "desiredReplicas": { "type": "integer", "minimum": 0 },
        "readyReplicas": { "type": "integer", "minimum": 0 },
        "readyPods": { "type": "integer", "minimum": 0 },
        "restarts": { "type": "integer", "minimum": 0 },
        "imageIds": {
          "type": "array",
          "uniqueItems": true,
          "items": { "type": "string", "pattern": "@sha256:[0-9a-f]{64}$" }
        }
      }
    },
    "devSnapshot": {
      "type": "object",
      "additionalProperties": false,
      "required": [
        "services",
        "healthEndpointsReady",
        "redisReady",
        "externalSecretReady",
        "redisClientsConfigured",
        "requiredConnectionsReady",
        "quotaUsed",
        "result"
      ],
      "properties": {
        "services": {
          "type": "array",
          "maxItems": 5,
          "items": { "$ref": "#/$defs/devServiceSnapshot" }
        },
        "healthEndpointsReady": { "type": "integer", "minimum": 0, "maximum": 5 },
        "redisReady": { "type": "boolean" },
        "externalSecretReady": { "type": "boolean" },
        "redisClientsConfigured": { "type": "boolean" },
        "requiredConnectionsReady": { "type": "boolean" },
        "quotaUsed": { "$ref": "#/$defs/resourceValues" },
        "result": { "$ref": "#/$defs/result" }
      }
    },
    "continuity": {
      "type": "object",
      "additionalProperties": false,
      "required": ["sample", "readyReplicaLoss", "restartDelta", "health", "result"],
      "properties": {
        "sample": { "type": "string", "minLength": 1 },
        "readyReplicaLoss": { "const": 0 },
        "restartDelta": { "const": 0 },
        "health": { "const": "healthy" },
        "result": { "const": "PASS" }
      }
    }
  }
}
